{
  "module": "M0.0",
  "scenarios": [
    "SMOKE-1 — scripts/sync-specs.sh est exécutable"
  ],
  "deliverables": [
    {
      "id": "M0.0-01",
      "ref_cdc": "specs/cdc/01 - Cahier des charges App/07 - Architecture technique.md",
      "artefact": null,
      "test": "SMOKE-1 — scripts/sync-specs.sh est exécutable",
      "statut": "implemented",
      "libelle": "SMOKE-1 — scripts/sync-specs.sh est exécutable"
    }
  ],
  "cdc_source_hash": {
    "specs/cdc/01 - Cahier des charges App/07 - Architecture technique.md": "00b34bb225b4b14e46b4a45a964bd6e24a0ea551de3f9d04c01a4d3c1579890e"
  }
}
